[
  {
    "id": "a",
    "name": "A隊",
    "aliases": [],
    "role": "supporting",
    "color": "#E67E22",
    "first_appearance": 15,
    "chapter_refs": [
      15
    ],
    "spoiler_level": 1,
    "description": "全書 1 章出現；詳情待人手審閱。",
    "confidence": 0.9,
    "review_status": "reviewed",
    "portrait_asset_id": null,
    "source": "bing_gang"
  },
  {
    "id": "angel",
    "name": "Angel小姐",
    "aliases": [],
    "role": "supporting",
    "color": "#9B59B6",
    "first_appearance": 144,
    "chapter_refs": [
      144
    ],
    "spoiler_level": 1,
    "description": "全書 1 章出現；詳情待人手審閱。",
    "confidence": 0.7,
    "review_status": "reviewed",
    "portrait_asset_id": null,
    "source": "bing_gang"
  },
  {
    "id": "ann",
    "name": "Ann",
    "aliases": [],
    "role": "supporting",
    "color": "#9B59B6",
    "first_appearance": 33,
    "chapter_refs": [
      33
    ],
    "spoiler_level": 1,
    "description": "全書 1 章出現；詳情待人手審閱。",
    "confidence": 0.9,
    "review_status": "reviewed",
    "portrait_asset_id": null,
    "source": "bing_gang"
  },
  {
    "id": "b",
    "name": "B隊",
    "aliases": [],
    "role": "supporting",
    "color": "#9B59B6",
    "first_appearance": 15,
    "chapter_refs": [
      15
    ],
    "spoiler_level": 1,
    "description": "全書 1 章出現；詳情待人手審閱。",
    "confidence": 0.9,
    "review_status": "reviewed",
    "portrait_asset_id": null,
    "source": "bing_gang"
  },
  {
    "id": "bomi",
    "name": "Bomi",
    "aliases": [],
    "role": "supporting",
    "color": "#9B59B6",
    "first_appearance": 103,
    "chapter_refs": [
      103,
      104,
      128,
      131
    ],
    "spoiler_level": 1,
    "description": "全書 4 章出現；詳情待人手審閱。",
    "confidence": 0.88,
    "review_status": "reviewed",
    "portrait_asset_id": null,
    "source": "bing_gang"
  },
  {
    "id": "chirs",
    "name": "Chirs",
    "aliases": [
      "傻仔Chirs"
    ],
    "role": "supporting",
    "color": "#E67E22",
    "first_appearance": 35,
    "chapter_refs": [
      35,
      39,
      40,
      59
    ],
    "spoiler_level": 1,
    "description": "全書 4 章出現；詳情待人手審閱。",
    "confidence": 0.92,
    "review_status": "reviewed",
    "portrait_asset_id": null,
    "source": "bing_gang"
  },
  {
    "id": "chris",
    "name": "Chris",
    "aliases": [
      "懦夫"
    ],
    "role": "supporting",
    "color": "#9B59B6",
    "first_appearance": 41,
    "chapter_refs": [
      41,
      43,
      44,
      45,
      48,
      49,
      50,
      52,
      53,
      54,
      60,
      61,
      63,
      105,
      173
    ],
    "spoiler_level": 1,
    "description": "全書 15 章出現；詳情待人手審閱。",
    "confidence": 0.91,
    "review_status": "reviewed",
    "portrait_asset_id": null,
    "source": "bing_gang"
  },
  {
    "id": "dick_grayson",
    "name": "Dick Grayson",
    "aliases": [],
    "role": "supporting",
    "color": "#9B59B6",
    "first_appearance": 42,
    "chapter_refs": [
      42,
      43
    ],
    "spoiler_level": 1,
    "description": "全書 2 章出現；詳情待人手審閱。",
    "confidence": 0.9,
    "review_status": "reviewed",
    "portrait_asset_id": null,
    "source": "bing_gang"
  },
  {
    "id": "dr_d",
    "name": "Dr.D第二任助手",
    "aliases": [
      "半紅點人"
    ],
    "role": "supporting",
    "color": "#E67E22",
    "first_appearance": 174,
    "chapter_refs": [
      174
    ],
    "spoiler_level": 1,
    "description": "全書 1 章出現；詳情待人手審閱。",
    "confidence": 0.97,
    "review_status": "reviewed",
    "portrait_asset_id": null,
    "source": "bing_gang"
  },
  {
    "id": "eagle",
    "name": "Eagle",
    "aliases": [],
    "role": "supporting",
    "color": "#1ABC9C",
    "first_appearance": 165,
    "chapter_refs": [
      165
    ],
    "spoiler_level": 1,
    "description": "全書 1 章出現；詳情待人手審閱。",
    "confidence": 0.7,
    "review_status": "reviewed",
    "portrait_asset_id": null,
    "source": "bing_gang"
  },
  {
    "id": "ent_012196a09e",
    "name": "阿洛",
    "aliases": [],
    "role": "supporting",
    "color": "#E67E22",
    "first_appearance": 96,
    "chapter_refs": [
      96
    ],
    "spoiler_level": 1,
    "description": "全書 1 章出現；詳情待人手審閱。",
    "confidence": 0.95,
    "review_status": "reviewed",
    "portrait_asset_id": null,
    "source": "bing_gang"
  },
  {
    "id": "ent_01740c3a54",
    "name": "不良人首領嘅副手",
    "aliases": [],
    "role": "supporting",
    "color": "#1ABC9C",
    "first_appearance": 109,
    "chapter_refs": [
      109
    ],
    "spoiler_level": 1,
    "description": "全書 1 章出現；詳情待人手審閱。",
    "confidence": 0.95,
    "review_status": "reviewed",
    "portrait_asset_id": null,
    "source": "bing_gang"
  },
  {
    "id": "ent_0314d499b9",
    "name": "王白蛋",
    "aliases": [],
    "role": "supporting",
    "color": "#1ABC9C",
    "first_appearance": 73,
    "chapter_refs": [
      73,
      74,
      80,
      81,
      84,
      86,
      87,
      88,
      91,
      92,
      97
    ],
    "spoiler_level": 1,
    "description": "全書 11 章出現；詳情待人手審閱。",
    "confidence": 0.92,
    "review_status": "reviewed",
    "portrait_asset_id": null,
    "source": "bing_gang"
  },
  {
    "id": "ent_03a3790ff2",
    "name": "敘事者嘅朋友",
    "aliases": [
      "兩位小朋友"
    ],
    "role": "supporting",
    "color": "#E67E22",
    "first_appearance": 159,
    "chapter_refs": [
      159
    ],
    "spoiler_level": 1,
    "description": "全書 1 章出現；詳情待人手審閱。",
    "confidence": 0.85,
    "review_status": "reviewed",
    "portrait_asset_id": null,
    "source": "bing_gang"
  },
  {
    "id": "ent_03ed7323aa",
    "name": "博士",
    "aliases": [],
    "role": "supporting",
    "color": "#F39C12",
    "first_appearance": 184,
    "chapter_refs": [
      184
    ],
    "spoiler_level": 1,
    "description": "全書 1 章出現；詳情待人手審閱。",
    "confidence": 0.95,
    "review_status": "reviewed",
    "portrait_asset_id": null,
    "source": "bing_gang"
  },
  {
    "id": "ent_0436f94834",
    "name": "貴華母親",
    "aliases": [
      "貴華嘅母親"
    ],
    "role": "supporting",
    "color": "#F39C12",
    "first_appearance": 197,
    "chapter_refs": [
      197
    ],
    "spoiler_level": 1,
    "description": "全書 1 章出現；詳情待人手審閱。",
    "confidence": 1.0,
    "review_status": "reviewed",
    "portrait_asset_id": null,
    "source": "bing_gang"
  },
  {
    "id": "ent_04b8775f3c",
    "name": "食店大叔",
    "aliases": [],
    "role": "supporting",
    "color": "#E67E22",
    "first_appearance": 120,
    "chapter_refs": [
      120
    ],
    "spoiler_level": 1,
    "description": "全書 1 章出現；詳情待人手審閱。",
    "confidence": 0.92,
    "review_status": "reviewed",
    "portrait_asset_id": null,
    "source": "bing_gang"
  },
  {
    "id": "ent_05b1ee1378",
    "name": "病腦",
    "aliases": [
      "三腦",
      "三腦大人",
      "大B OSS",
      "大佬",
      "大廚",
      "病廚"
    ],
    "role": "supporting",
    "color": "#F39C12",
    "first_appearance": 3,
    "chapter_refs": [
      3,
      4,
      5,
      6,
      7,
      8,
      9,
      10,
      12,
      15,
      18,
      43,
      44,
      45,
      50,
      52,
      53,
      54,
      66,
      76,
      80,
      82,
      85,
      87,
      88,
      89,
      90,
      91,
      99,
      131,
      132,
      138,
      139,
      140,
      141,
      142,
      143,
      144,
      163,
      172,
      175,
      178,
      180,
      186,
      192
    ],
    "spoiler_level": 1,
    "description": "全書 45 章出現；詳情待人手審閱。",
    "confidence": 0.88,
    "review_status": "reviewed",
    "portrait_asset_id": null,
    "source": "bing_gang"
  },
  {
    "id": "ent_087ebc353e",
    "name": "掃把頭不良人大叔",
    "aliases": [
      "標準不良人外表大叔"
    ],
    "role": "supporting",
    "color": "#F39C12",
    "first_appearance": 71,
    "chapter_refs": [
      71
    ],
    "spoiler_level": 1,
    "description": "全書 1 章出現；詳情待人手審閱。",
    "confidence": 0.84,
    "review_status": "reviewed",
    "portrait_asset_id": null,
    "source": "bing_gang"
  },
  {
    "id": "ent_09b0ade3b9",
    "name": "明哥",
    "aliases": [
      "明雲嘅父",
      "金鷹頭"
    ],
    "role": "supporting",
    "color": "#F39C12",
    "first_appearance": 157,
    "chapter_refs": [
      157,
      160,
      161
    ],
    "spoiler_level": 1,
    "description": "全書 3 章出現；詳情待人手審閱。",
    "confidence": 0.97,
    "review_status": "reviewed",
    "portrait_asset_id": null,
    "source": "bing_gang"
  },
  {
    "id": "ent_0ad2def3f5",
    "name": "滿天",
    "aliases": [
      "南瓜貝果",
      "叛徒",
      "天兄",
      "滿天先生",
      "貝果先生",
      "貴華",
      "貴華先生",
      "醫生袍男人",
      "面具主角"
    ],
    "role": "supporting",
    "color": "#E67E22",
    "first_appearance": 51,
    "chapter_refs": [
      51,
      52,
      53,
      54,
      55,
      56,
      57,
      58,
      65,
      67,
      74,
      79,
      84,
      85,
      88,
      89,
      90,
      91,
      94,
      95,
      97,
      113,
      118,
      119,
      121,
      123,
      126,
      131,
      132,
      133,
      134,
      135,
      136,
      137,
      138,
      140,
      142,
      143,
      144,
      146,
      147,
      163,
      168,
      171,
      173,
      174,
      175,
      178,
      179,
      181
    ],
    "spoiler_level": 1,
    "description": "全書 56 章出現；詳情待人手審閱。",
    "confidence": 0.88,
    "review_status": "reviewed",
    "portrait_asset_id": null,
    "source": "bing_gang"
  },
  {
    "id": "ent_0ae6a850a7",
    "name": "女主唱",
    "aliases": [],
    "role": "supporting",
    "color": "#F39C12",
    "first_appearance": 120,
    "chapter_refs": [
      120
    ],
    "spoiler_level": 1,
    "description": "全書 1 章出現；詳情待人手審閱。",
    "confidence": 0.9,
    "review_status": "reviewed",
    "portrait_asset_id": null,
    "source": "bing_gang"
  },
  {
    "id": "ent_0b233e74ac",
    "name": "胡子老闆",
    "aliases": [],
    "role": "supporting",
    "color": "#E67E22",
    "first_appearance": 119,
    "chapter_refs": [
      119,
      120,
      121,
      122
    ],
    "spoiler_level": 1,